{
    "answerId": "19fb1e4b-0bcb-4157-9537-16c1d3c4d7e9",
    "reviewLevelId": "3397d4a9-ad51-497c-a545-8a983d7edf52",
    "questionId": "5b3386a4-3e48-473d-9df2-5cd83a549834",
    "qaTreeId": "BEE76DDC-5907-435C-80D1-45F894F7BD3C",
    "answers": [
        {
            "code": "Yes",
            "description": "Yes"
        }
    ]
}